{
  "storyline_id": "anny_storyline_5c95ee31f95d_v1",
  "title": "생산적 금융으로의 전환: 담보·단기수익에서 장기 위험분담으로?",
  "subtitle": "국민성장펀드와 은행 규제가 만나는 지점에서 던지는 질문",
  "one_liner": "이억원 금융위원장의 경고를 출발점으로, 국민성장펀드 설계와 은행 규제가 왜 '장기 위험자본' 문제로 귀결되는지 짚는다.",
  "estimated_slide_count": 24,
  "section_plan": [
    {
      "section_title": "1) Seed & 문제 제기",
      "purpose": "방송 초반에 핵심 문장(이억원 발언)으로 청취자 관심을 끌고 토론 질문을 던진다.",
      "required_key_beats": [
        "kb_collateral_short_term_limit"
      ],
      "planned_slide_count": 4
    },
    {
      "section_title": "2) 국민성장펀드와 정책 설계(증거 모음)",
      "purpose": "국민성장펀드의 규모·구조·운용계획을 공식 자료로 정리해 청중에게 근거를 제공한다.",
      "required_key_beats": [
        "kb_growth_fund_policy_finance",
        "kb_long_term_risk_capital"
      ],
      "planned_slide_count": 7
    },
    {
      "section_title": "3) 금융구조·제약: 담보·단기수익의 한계와 장기 위험의 분담",
      "purpose": "은행 규제(Basel)와 국내 논의가 왜 장기 리스크를 기피하게 만드는지, 누가 위험을 부담할 수 있는지 구조적으로 설명한다.",
      "required_key_beats": [
        "kb_collateral_short_term_limit",
        "kb_long_term_risk_capital",
        "kb_risk_sharing_boundary"
      ],
      "planned_slide_count": 8
    },
    {
      "section_title": "4) 반대 관점·리스크와 마무리 질문",
      "purpose": "국민참여형 펀드의 반대 논지와 위험을 정리하고 '금융의 본질' 질문으로 마무리한다.",
      "required_key_beats": [
        "kb_counterpoint_policy_risk",
        "kb_risk_sharing_boundary"
      ],
      "planned_slide_count": 5
    }
  ],
  "key_beat_coverage": [
    {
      "key_beat": "담보·단기수익 중심 금융의 한계",
      "key_beat_id": "kb_collateral_short_term_limit",
      "covered": true,
      "slide_refs": [
        2,
        18
      ],
      "coverage_note": "이억원 발언(후보 기사)을 hook으로 사용하고, 은행 규제·행동을 설명하는 구조적 슬라이드로 보강."
    },
    {
      "key_beat": "AI/반도체 투자와 장기 위험자본 필요",
      "key_beat_id": "kb_long_term_risk_capital",
      "covered": true,
      "slide_refs": [
        8,
        21
      ],
      "coverage_note": "국민성장펀드 공식 자료와 정책 기사에서 AI·반도체 대상으로 5년 150조 계획을 인용해 장기 자금 필요성을 제시."
    },
    {
      "key_beat": "국민성장펀드/정책금융 논쟁",
      "key_beat_id": "kb_growth_fund_policy_finance",
      "covered": true,
      "slide_refs": [
        4,
        13
      ],
      "coverage_note": "공식 보도자료·정책브리핑 URL을 근거로 펀드 설계(규모·판매·손실분담)를 정리."
    },
    {
      "key_beat": "금융권이 어디까지 위험을 나눌 수 있는가",
      "key_beat_id": "kb_risk_sharing_boundary",
      "covered": true,
      "slide_refs": [
        14,
        19
      ],
      "coverage_note": "국민참여형 구조의 손실우선 부담·민간 매칭 규칙을 근거로 '위험을 나눌' 주체와 한계를 논의."
    },
    {
      "key_beat": "반대 관점/리스크",
      "key_beat_id": "kb_counterpoint_policy_risk",
      "covered": true,
      "slide_refs": [
        16,
        20
      ],
      "coverage_note": "인베스트조선의 비판 기사를 인용해 관치금융·손실사회화 우려를 제시."
    }
  ],
  "sections": [
    {
      "section_title": "Seed & 문제 제기",
      "purpose": "이억원 발언으로 출발해 핵심 질문을 던진다.",
      "slides": [
        {
          "slide_type": "title",
          "headline": "생산적 금융과 정책자금 전환",
          "body": [
            "이억원 금융위원장의 경고에서 시작한 토론: 금융은 안전하게 빌려주는 산업인가, 위험을 나눠 성장에 베팅하는 산업인가?"
          ],
          "source_urls": [],
          "image_urls": [],
          "notes": "title / no factual claim. Rhetorical framing only.",
          "needs_fact_check": false,
          "needs_source": false
        },
        {
          "slide_type": "hook",
          "headline": "담보·단기수익 — 이억원 \"담보 및 단기수익 중심 금융 경쟁 앞서가기 어려워\"",
          "body": [
            "담보·단기수익 중심 금융의 한계를 지적한 발언을 출발점으로 삼는다."
          ],
          "source_urls": [
            "https://news.einfomax.co.kr/news/articleView.html?idxno=4415444"
          ],
          "image_urls": [],
          "notes": "fact_check_priority: high. 원문 전문 확인 필요(후보 기사). fact_check_kind: institution_quote_context. required_before_broadcast: 원문 확인 및 발언 맥락 점검.",
          "needs_fact_check": true,
          "needs_source": false,
          "covers_key_beats": [
            "kb_collateral_short_term_limit"
          ],
          "key_beat_anchors_used": [
            {
              "key_beat_id": "kb_collateral_short_term_limit",
              "anchor_phrase": "담보·단기수익"
            }
          ]
        },
        {
          "slide_type": "rhetorical",
          "headline": "금융은 안전하게 돈을 빌려주는 산업인가, 성장 위험을 나눠지는 산업인가?",
          "body": [
            "방송이 던질 근본 질문을 명확히 한다."
          ],
          "source_urls": [],
          "image_urls": [],
          "notes": "rhetorical bridge / no factual claim. 순수 질문형으로 source 없이 허용.",
          "needs_fact_check": false,
          "needs_source": false
        },
        {
          "slide_type": "explainer",
          "headline": "핵심 관찰: 세계적 경쟁은 AI·반도체·배터리에 장기자본을 요구한다",
          "body": [
            "정책담당자들이 '생산적 투자'로 금융 역할 이동을 주문하는 배경을 요약한다."
          ],
          "source_urls": [
            "https://news.einfomax.co.kr/news/articleView.html?idxno=4415444"
          ],
          "image_urls": [],
          "notes": "지원 근거로 후보 기사 인용. fact_check_priority: medium. 사실관계 보강을 위해 정책브리핑(국민성장펀드) 자료 연결 필요.",
          "needs_fact_check": true,
          "needs_source": false
        }
      ]
    },
    {
      "section_title": "국민성장펀드: 설계와 숫자(공식 자료 중심)",
      "purpose": "공식 자료로 펀드 규모·판매·손실분담 구조를 정리한다.",
      "slides": [
        {
          "slide_type": "data",
          "headline": "국민성장펀드: 5년간 150조 계획(공식)",
          "body": [
            "국민성장펀드는 민관합동으로 '5년 150조원' 규모를 목표로 한다."
          ],
          "source_urls": [
            "https://ngf.kdb.co.kr/GFMNMN00N00.act",
            "https://www.korea.kr/news/policyNewsView.do?newsId=148961201&pWise=main&pWiseMain=A4"
          ],
          "image_urls": [],
          "notes": "fact_check_priority: high. 수치 출처는 공식 페이지와 정책브리핑(국민성장펀드)이며 방송 전 숫자(150조·기간 등) 원자료 확인 필수.",
          "needs_fact_check": true,
          "needs_source": false,
          "covers_key_beats": [
            "kb_growth_fund_policy_finance"
          ],
          "key_beat_anchors_used": [
            {
              "key_beat_id": "kb_growth_fund_policy_finance",
              "anchor_phrase": "국민성장펀드"
            }
          ]
        },
        {
          "slide_type": "image_centered",
          "headline": "국민참여형 펀드 상품구조(시각 자료 후보)",
          "body": [
            "판매/손실분담/재정 후순위 등 구조를 카드뉴스형 시각자료로 정리한 후보."
          ],
          "source_urls": [],
          "image_urls": [
            "https://www.korea.kr/multi/visualNewsView.do?newsId=148964200&pWise=main&pWiseMain=K3"
          ],
          "notes": "이미지 출처: 정책브리핑 카드뉴스. visual candidate 사용 시 저작권·공식성 확인 필요.",
          "needs_fact_check": false,
          "needs_source": false
        },
        {
          "slide_type": "explainer",
          "headline": "국민참여형: 판매·손실우선 부담 구조",
          "body": [
            "공식 자료: 국민 모집액(예시), 재정 후순위 보강, 자펀드별 손실 우선 부담 규정 등을 확인할 수 있다."
          ],
          "source_urls": [
            "https://www.korea.kr/news/policyNewsView.do?newsId=148963908&pWise=main&pWiseMain=R3",
            "https://m.korea.kr/briefing/pressReleaseView.do?newsId=156739847"
          ],
          "image_urls": [],
          "notes": "fact_check_priority: high. 슬라이드의 수치·비율(예: 모집액 6000억, 재정 1200억 등)은 원문 확인 필요.",
          "needs_fact_check": true,
          "needs_source": false
        },
        {
          "slide_type": "data",
          "headline": "1차 프로젝트: AI·반도체·이차전지 등 7건(공식)",
          "body": [
            "정책브리핑은 1차 프로젝트로 첨단전략산업을 명시한다."
          ],
          "source_urls": [
            "https://m.korea.kr/news/policyNewsView.do?newsId=148956795"
          ],
          "image_urls": [],
          "notes": "fact_check_priority: medium. 프로젝트 목록·선정 기준은 보도자료 원문 확인 필요.",
          "needs_fact_check": true,
          "needs_source": false,
          "covers_key_beats": [
            "kb_long_term_risk_capital"
          ],
          "key_beat_anchors_used": [
            {
              "key_beat_id": "kb_long_term_risk_capital",
              "anchor_phrase": "장기 위험자본"
            }
          ]
        },
        {
          "slide_type": "explainer",
          "headline": "정책 설계 핵심: 직접투자·간접투자·초저리대출의 혼합",
          "body": [
            "공식 소개는 다양한 운용 수단(직접/간접/인프라/대출)을 통해 생태계 전반을 지원한다고 밝힌다."
          ],
          "source_urls": [
            "https://ngf.kdb.co.kr/GFMNMN00N00.act",
            "https://m.korea.kr/briefing/pressReleaseView.do?newsId=156739847"
          ],
          "image_urls": [],
          "notes": "fact_check_priority: medium. 각 수단의 비중·선택기준은 운용사 공모자료 등으로 확인 필요.",
          "needs_fact_check": true,
          "needs_source": false
        },
        {
          "slide_type": "bridge",
          "headline": "요약: 공식 자료가 말하는 '무엇'과 우리가 던질 '질문'",
          "body": [
            "공식은 대규모 자금·혼합 운용·손실분담 설계를 제시한다. 그렇다면 실제로 '누가 긴 위험을 흡수'하는가?"
          ],
          "source_urls": [
            "https://m.korea.kr/briefing/pressReleaseView.do?newsId=156739847"
          ],
          "image_urls": [],
          "notes": "방송 전 운용계약서·공모자료 등 추가 확인 권장.",
          "needs_fact_check": true,
          "needs_source": false
        }
      ]
    },
    {
      "section_title": "금융구조와 제약: 누가 긴 위험을 맡을 것인가",
      "purpose": "은행 규제·시장 행태가 장기투자를 꺼리는 이유와 대안(정책금융)을 구조적으로 설명한다.",
      "slides": [
        {
          "slide_type": "section_title",
          "headline": "은행은 왜 담보와 단기수익을 선호하나?",
          "body": [
            "규제와 자본비용이 장기·고위험 투자를 제한한다."
          ],
          "source_urls": [
            "https://www.bis.org/bcbs/basel3.htm"
          ],
          "image_urls": [],
          "notes": "section title with factual pointer to Basel framework. 사실관계는 BIS 문서로 근거 제시.",
          "needs_fact_check": false,
          "needs_source": false
        },
        {
          "slide_type": "explainer",
          "headline": "담보·단기수익",
          "body": [
            "은행은 담보가 확실하고 회수 가능성이 높은 단기 수익 모델을 선호한다(규제·자본비율 영향)."
          ],
          "source_urls": [
            "https://www.bis.org/bcbs/basel3.htm",
            "https://news.einfomax.co.kr/news/articleView.html?idxno=4415444"
          ],
          "image_urls": [],